{
  "schemaVersion": 1,
  "contract": "kfd.derived-capability-manifest/v1",
  "id": "minimal-capability-manifest",
  "subject": {
    "protocolId": "kfd-alpha68",
    "protocolVersion": "1.0.0-alpha.68",
    "evidencePackRoot": "sha256:1111111111111111111111111111111111111111111111111111111111111111",
    "observationRoot": "sha256:2222222222222222222222222222222222222222222222222222222222222222"
  },
  "capabilities": [
    {
      "id": "accepted-completion",
      "state": "declared",
      "declarationRoots": ["sha256:3333333333333333333333333333333333333333333333333333333333333333"],
      "observationRoots": [],
      "verificationRoots": []
    },
    {
      "id": "durable-task",
      "state": "observed",
      "declarationRoots": ["sha256:3333333333333333333333333333333333333333333333333333333333333333"],
      "observationRoots": ["sha256:4444444444444444444444444444444444444444444444444444444444444444"],
      "verificationRoots": []
    },
    {
      "id": "semantic-closure",
      "state": "verified",
      "declarationRoots": ["sha256:3333333333333333333333333333333333333333333333333333333333333333"],
      "observationRoots": ["sha256:4444444444444444444444444444444444444444444444444444444444444444"],
      "verificationRoots": ["sha256:5555555555555555555555555555555555555555555555555555555555555555"]
    }
  ],
  "claimBoundary": {
    "derivedEvidenceStateOnly": true,
    "certification": false,
    "runtimeAuthority": false,
    "productionFitness": false
  }
}
